movie_id,title,genre,year,plot,rating
200,Baby Driver,Crime/Action/Music,2017,"After being coerced into working for a crime boss, a young getaway driver finds himself taking part in a heist doomed to fail. Edgar Wright choreographs action to music with virtuosic skill.",7.6
201,Whiplash,Drama/Music,2014,"A promising young drummer enrolls at a cut-throat music conservatory where his dreams of greatness are challenged by an abusive instructor.",8.5
202,Black Panther,Action/Sci-Fi,2018,"T'Challa, heir to the hidden but advanced kingdom of Wakanda, must step forward to lead his people into a new future and must confront a challenger from his country's past. Ryan Coogler's film is a cultural milestone.",7.3
203,Spider-Man: Into the Spider-Verse,Animation/Action,2018,"Teen Miles Morales becomes the Spider-Man of his universe and must join with five spider-powered individuals from other dimensions to stop a threat for all realities. The most visually innovative animated superhero film ever made.",8.4
204,Thor: Ragnarok,Action/Comedy,2017,"Imprisoned on the planet Sakaar, Thor must race against time to return to Asgard and stop Ragnarök, the destruction of his world at the hands of the powerful and ruthless villain Hela. Taika Waititi reinvents Thor as a comedy.",7.9
205,Guardians of the Galaxy,Action/Sci-Fi/Comedy,2014,"A group of intergalactic criminals must pull together to stop a fanatical warrior with plans to purge the universe. James Gunn's space opera is the most unexpectedly hilarious film in the Marvel catalogue.",8.0
206,Iron Man,Action/Sci-Fi,2008,"After being held captive in an Afghan cave, billionaire engineer Tony Stark creates a unique weaponized suit of armor to fight evil. Robert Downey Jr.'s performance launched the Marvel Cinematic Universe.",7.9
207,Captain America: The Winter Soldier,Action/Thriller,2014,"As Steve Rogers struggles to embrace his role in the modern world, he teams up with a fellow Avenger and S.H.I.E.L.D agent, Black Widow, to battle a new threat from history. The Russo Brothers bring political thriller energy to Marvel.",7.8
208,Logan,Action/Drama,2017,"In the near future, a weary Logan cares for an ailing Professor X somewhere on the Mexican border. When a young mutant arrives being pursued by dark forces, Logan must protect the girl and battle the demons from his own past.",8.1
209,Deadpool,Action/Comedy,2016,"A wisecracking mercenary gets experimented on and becomes immortal but ugly, and sets out to track down the man who ruined his looks. Ryan Reynolds finally got the Deadpool movie he had spent over a decade trying to make.",8.0
210,Doctor Strange,Action/Sci-Fi/Fantasy,2016,"A former neurosurgeon embarks on a journey of healing only to be drawn into the world of the mystic arts. A visually inventive entry into the MCU that explores the multiverse concept.",7.5
211,Ant-Man,Action/Comedy/Sci-Fi,2015,"Armed with a super-suit with the astonishing ability to shrink in scale but increase in strength, cat burglar Scott Lang must embrace his inner hero and help his mentor protect the secret behind his spectacular Ant-Man suit from a new generation of towering threats.",7.3
212,Wonder Woman,Action/Drama,2017,"Before she was Wonder Woman she was Diana, princess of the Amazons, trained warrior. When a pilot crashes and tells of conflict in the outside world, Diana leaves home to fight a war to end all wars. Patty Jenkins delivers the definitive DC superhero film.",7.4
213,Aquaman,Action/Fantasy,2018,"Arthur Curry, the human-born heir to the underwater kingdom of Atlantis, goes on a quest to prevent a war between the worlds of ocean and land. James Wan delivers spectacular underwater action sequences.",6.9
214,Shazam!,Action/Comedy,2019,"We all have a superhero inside us, it just takes a bit of magic to bring it out. In Billy Batson's case, by shouting out one word, this streetwise 14-year-old foster kid can turn into the adult superhero Shazam. A charming, family-friendly DC entry.",7.0
215,Joker,Drama/Thriller,2019,"In Gotham City, mentally troubled comedian Arthur Fleck is disregarded and mistreated by society. He then embarks on a downward spiral of revolution and bloody crime. Joaquin Phoenix's committed performance is extraordinary.",8.4
216,The Batman,Crime/Action,2022,"When the Riddler, a sadistic serial killer, begins murdering key political figures in Gotham, Batman is forced to investigate the city's hidden corruption and question his family's involvement. Matt Reeves brings a brooding detective noir to the character.",7.9
217,Dune,Sci-Fi/Adventure,2021,"A noble family becomes embroiled in a war for control over the galaxy's most valuable asset while its heir becomes troubled by visions of a dark future. Denis Villeneuve's adaptation of Frank Herbert's masterwork is visually staggering.",8.0
218,Arrival,Sci-Fi/Drama,2016,"When mysterious spacecraft touch down across the globe, an elite team is put together to investigate, including language expert Louise Banks. A film about language, time, and grief that builds to a shattering conclusion.",7.9
219,Tenet,Action/Sci-Fi,2020,"Armed with only one word, Tenet, and fighting for the survival of the entire world, a protagonist journeys through a twilight world of international espionage on a mission that will unfold in something beyond real time. Christopher Nolan at his most cryptic.",7.4
220,Dunkirk,War/Drama/Action,2017,"Allied soldiers from Belgium, the British Commonwealth and Empire and France are surrounded by the German Army and evacuated during a fierce battle in World War II. Nolan's most formally austere and immersive film.",7.9
221,1917,War/Drama,2019,"As a regiment assembles to wage war deep in enemy territory, two soldiers are assigned to race against time and deliver a message that will stop 1,500 men from walking straight into a deadly trap. Deakins' one-take cinematography is astonishing.",8.3
222,Hacksaw Ridge,War/Biography/Drama,2016,"The true story of Desmond T. Doss, the conscientious objector who, at the Battle of Okinawa, won the Medal of Honor for his incredible bravery and regard for his fellow soldiers. Gibson's comeback as director is stunning.",8.1
223,Midway,War/Action,2019,"The story of the Battle of Midway, told by the leaders and sailors who fought it. A straightforward celebration of American military heroism in one of the Pacific War's decisive confrontations.",6.7
224,The Revenant,Drama/Adventure,2015,"A frontiersman on a fur trading expedition in the 1820s fights for survival after being mauled by a bear. Iñárritu and Lubezki capture the American wilderness with breathtaking beauty.",8.0
225,Roma,Drama,2018,"A year in the life of a middle-class family's maid in Mexico City in the early 1970s. Alfonso Cuarón's black-and-white masterpiece is a deeply personal meditation on class, gender, and memory. Won three Academy Awards.",7.7
226,The Farewell,Drama/Comedy,2019,"A Chinese-American woman returns to China under the guise of a fake wedding to stow away her family's bombshell news from her beloved grandma. Lulu Wang's film navigates cultural collision with delicate grace.",7.5
227,Crazy Rich Asians,Romance/Comedy,2018,"This contemporary romantic comedy, based on a global bestseller, follows native New Yorker Rachel Chu to Singapore to meet her boyfriend's family. A charming, opulent celebration of Asian-American culture and identity.",6.9
228,Always Be My Maybe,Romance/Comedy,2019,"Childhood friends Sasha and Marcus reconnect after sixteen years when Sasha returns to San Francisco. Ali Wong and Randall Park have irresistible chemistry in this sweet, funny romantic comedy.",6.8
229,To All the Boys I've Loved Before,Romance/Comedy,2018,"Lara Jean's love life goes from imaginary to out of control when her secret love letters are unexpectedly mailed out. Peter Kavinsky became the internet's favourite fictional boyfriend overnight.",7.0
230,Eighth Grade,Coming-of-Age/Drama,2018,"An introverted thirteen-year-old girl tries to survive the last week of her disastrous middle school career before starting high school. Bo Burnham's directorial debut captures adolescence with painful accuracy.",7.4
231,Superbad,Comedy,2007,"Two co-dependent high school seniors are forced to deal with separation anxiety after their plan to stage a booze-soaked party goes awry. A raucously funny celebration of male friendship and teenage anxiety.",7.6
232,The Hangover,Comedy,2009,"Three buddies wake up from a bachelor party in Las Vegas, with no memory of the previous night and the bachelor missing. They make their way around the city in order to find their friend before his wedding. A comedy machine that works perfectly.",7.7
233,Bridesmaids,Comedy/Romance,2011,"Competition between the maid of honor and a bridesmaid, over who is the bride's best friend, threatens to upend the life of an out-of-luck woman. Kristen Wiig's breakthrough is one of the funniest films about female friendship.",6.8
234,Crazy, Stupid, Love,Romance/Comedy,2011,"A middle-aged husband's life changes dramatically when his wife asks for a divorce. He seeks to rediscover his manhood with the help of a newfound friend this is particularly good at picking up girls. A warm and surprisingly tender film.",7.4
235,About Time,Romance/Comedy/Drama,2013,"At the age of 21, Tim discovers he can travel in time and change what happens and has happened in his own life. He decides to use this ability to get a girlfriend. Richard Curtis' most emotionally resonant film.",7.8
236,Me Before You,Romance/Drama,2016,"A small-town girl is caught between dead-end jobs. A change arrives in the form of a man who enters her life in an unexpected way. Emilia Clarke and Sam Claflin bring genuine chemistry to this weepy romance.",7.4
237,The Fault in Our Stars,Romance/Drama,2014,"Two teenage cancer patients begin a life-affirming journey to visit a reclusive author in Amsterdam. A tearjerker that earns its tears through genuine performances and an understanding of how illness transforms young lives.",7.7
238,Call Me by Your Name,Romance/Drama,2017,"In 1980s Italy, romance blossoms between a seventeen-year-old student and the older man hired as his father's research assistant. Luca Guadagnino's luminous film captures the particular agony of first love.",7.9
239,Brokeback Mountain,Romance/Drama,2005,"The story of a complex romantic and sexual relationship between two cowboys and their lives over the years. Ang Lee's film was a landmark in LGBTQ+ cinema, nominated for eight Academy Awards.",7.7
240,Carol,Romance/Drama,2015,"An aspiring photographer develops an intimate relationship with an older woman in 1950s New York. Todd Haynes' film is a masterpiece of visual storytelling, conveying desire through glances and gestures.",7.2
241,The Remains of the Day,Drama/Romance,1993,"A butler who sacrificed body and soul to service in the years leading up to World War II realizes too late how misguided his loyalty and his heart truly were. Anthony Hopkins and Emma Thompson create one of cinema's great almost-romances.",7.8
242,Atonement,Drama/Romance,2007,"Fledgling writer Briony Tallis irrevocably changes the course of several lives when she accuses her older sister's lover of a crime he did not commit. A devastating examination of guilt, memory, and the limits of fiction.",7.8
243,Shakespeare in Love,Romance/Comedy/Historical,1998,"A young Shakespeare, out of ideas and short of cash, meets his ideal woman and is inspired to write Romeo and Juliet. Joseph Fiennes and Gwyneth Paltrow have sparkling chemistry in this Oscar-winning romantic comedy.",7.1
244,Much Ado About Nothing,Romance/Comedy,1993,"Benedick and Beatrice, both vocal opponents of love, are tricked by their friends into falling for each other in Shakespeare's most effortlessly funny romantic comedy. Kenneth Branagh's adaptation is a pure delight.",7.3
245,My Big Fat Greek Wedding,Romance/Comedy,2002,"A young Greek woman falls in love with a non-Greek and struggles to get her family to accept him while she goes through a process of self-discovery. A low-budget sleeper hit that became one of the most profitable romantic comedies of all time.",6.6
246,The Terminal,Drama/Comedy/Romance,2004,"An eastern European tourist's homeland is engulfed in a coup while he's in the air, leaving him stranded in JFK airport indefinitely. Tom Hanks and Spielberg create a charming fable about displacement and human kindness.",6.7
247,Cast Away,Drama/Adventure,2000,"A FedEx executive undergoes a physical and emotional transformation after crash landing on a deserted island. Tom Hanks' silent performance opposite a volleyball named Wilson is one of cinema's great one-man shows.",7.8
248,The Pursuit of Happyness,Drama/Biography,2006,"A struggling salesman takes custody of his son as he's poised to begin a life-changing professional endeavor. Will Smith gives a performance of quiet, sustained dignity that transcends the film's inspirational formula.",8.0
249,Hidden Figures,Drama/Biography,2016,"The story of a team of female African-American mathematicians who served a vital role in NASA during the early years of the U.S. space program. An uplifting celebration of overlooked heroes.",7.8
250,The Blind Side,Drama/Biography,2009,"The story of Michael Oher, a homeless and traumatized boy who became an All American football player and first round NFL draft pick with the help of a caring woman and her family. Sandra Bullock won the Oscar for her performance.",7.7
