movie_id,title,genre,year,plot,rating
101,2001: A Space Odyssey,Sci-Fi,1968,"After discovering a mysterious artifact buried beneath the Lunar surface, mankind sets off on a quest to find its origins with help from intelligent supercomputer H.A.L. 9000. Kubrick's epochal film redefined what science fiction cinema could be.",8.3
102,Blade Runner 2049,Sci-Fi,2017,"A young blade runner's discovery of a long-buried secret leads him to track down former blade runner Rick Deckard, who's been missing for thirty years. Denis Villeneuve's visually stunning sequel surpasses most expectations.",8.0
103,The Fifth Element,Sci-Fi/Action,1997,"In the colorful future, a cab driver unwillingly becomes the central figure in the search for a legendary cosmic weapon to keep Evil and Mr. Zorg at bay. Luc Besson's wildly inventive sci-fi opera.",7.6
104,Star Wars: Episode IV - A New Hope,Sci-Fi/Adventure,1977,"Luke Skywalker joins forces with a Jedi Knight, a cocky pilot, a Wookiee and two droids to save the galaxy from the Empire's world-destroying battle station. The film that changed popular cinema forever.",8.6
105,Star Wars: The Empire Strikes Back,Sci-Fi/Adventure,1980,"After the Rebels are overpowered by the Empire on the ice planet Hoth, Luke Skywalker begins Jedi training with Yoda, while his friends are pursued by Darth Vader. Widely considered the greatest sequel ever made.",8.7
106,E.T. the Extra-Terrestrial,Sci-Fi/Family,1982,"A troubled child summons the courage to help a friendly alien escape Earth and return to his home planet. Spielberg's most emotionally transparent film remains one of cinema's great tearjerkers.",7.9
107,Close Encounters of the Third Kind,Sci-Fi,1977,"Roy Neary, an everyday Indiana electric lineman, finds his quiet life disrupted when he has an encounter with a UFO. Spielberg's optimistic first contact story stands in contrast to most alien invasion narratives.",7.6
108,Jurassic Park,Sci-Fi/Adventure,1993,"A pragmatic paleontologist visiting an almost complete theme park is tasked with protecting a couple of kids after a power failure causes the park's cloned dinosaurs to run loose. Spielberg delivered a new benchmark in visual effects.",8.2
109,Contact,Sci-Fi/Drama,1997,"Dr. Ellie Arroway, after years of searching, finds conclusive radio proof of intelligent aliens, who send plans for a mysterious machine. Robert Zemeckis' patient, philosophical sci-fi rewards viewers who prefer ideas to spectacle.",7.5
110,Gattaca,Sci-Fi/Thriller,1997,"A genetically inferior man assumes the identity of a superior one in order to pursue his lifelong dream of space travel. Ethan Hawke stars in one of the most elegant and underrated science fiction films ever made.",7.8
111,The Thing,Horror/Sci-Fi,1982,"A research team in Antarctica is hunted by a shape-shifting alien that assumes the appearance of its victims. John Carpenter's paranoid masterpiece is one of the great ensemble horror films.",8.1
112,Alien,Sci-Fi/Horror,1979,"After a space merchant vessel perceives an unknown transmission as a distress call, its landing on the source moon finds one of the crew attacked by a mysterious lifeform, and they soon realize that its life cycle has merely begun. Ridley Scott's masterpiece.",8.5
113,Predator,Sci-Fi/Action,1987,"A team of commandos on a mission in a Central American jungle find themselves hunted by an extraterrestrial warrior. A stripped-down, brilliantly paced action-horror hybrid.",7.8
114,RoboCop,Sci-Fi/Action,1987,"In a dystopic and crime-ridden Detroit, a terminally wounded cop returns to the force as a powerful cyborg haunted by submerged memories. Paul Verhoeven's satire is disguised as a violent action film.",7.5
115,Total Recall,Sci-Fi/Action,1990,"When a man goes in to have memories of a holiday implanted, he finds himself on the run from operatives of the very company who run the memory clinic. Verhoeven delivers Schwarzenegger's most interesting film.",7.5
116,The Sixth Sense,Thriller/Horror,1999,"A boy who communicates with spirits seeks the help of a disheartened child psychologist. M. Night Shyamalan's film contains one of cinema's most famous twists, executed with remarkable skill.",8.1
117,Signs,Sci-Fi/Thriller,2002,"A family living on a farm finds mysterious crop circles in their fields which suggests something more frightening to come. M. Night Shyamalan mines genuine terror from glimpses and shadows rather than full reveals.",6.7
118,Unbreakable,Superhero/Drama,2000,"A man learns something extraordinary about himself after a devastating accident. M. Night Shyamalan's quiet, methodical deconstruction of the superhero origin story anticipated the genre's peak by two decades.",7.3
119,Split,Thriller/Horror,2016,"Three girls are kidnapped by a man with 24 distinct personalities and must try to escape before the apparent emergence of a frightful new 21st personality. James McAvoy delivers a showstopping multi-character performance.",7.3
120,Princess Mononoke,Animation/Fantasy,1997,"On a journey to find the cure for a Tatarigami's curse, Ashitaka finds himself in the middle of a war between the forest gods and Tatara, a mining colony. Miyazaki's epic is a masterpiece of environmental storytelling.",8.4
121,My Neighbor Totoro,Animation/Fantasy,1988,"When two girls move to the country to be near their ailing mother, they have adventures with the wondrous forest spirits who live nearby. Miyazaki's most purely joyful film is also his most beloved.",8.2
122,Nausicaä of the Valley of the Wind,Animation/Sci-Fi,1984,"In the post-apocalyptic future, Nausicaä, a young princess of the Valley of the Wind, struggles to prevent two warring nations from destroying themselves and their dying planet. Miyazaki's first and foundational masterpiece.",8.1
123,Castle in the Sky,Animation/Adventure,1986,"A young boy and a girl with a magic crystal must race against pirates and government agents to find a legendary floating castle. A pure adventure story told with irresistible energy and imagination.",8.0
124,Howl's Moving Castle,Animation/Fantasy,2004,"When an unconfident young woman is cursed with an old body by a spiteful witch, her only chance of breaking the spell lies with a self-indulgent yet insecure young wizard and his companions. A meditation on war and self-acceptance.",8.2
125,Ghost in the Shell,Animation/Sci-Fi,1995,"In the near future, a cyborg policewoman and her partner hunt a mysterious and powerful hacker called the Puppet Master. The foundational text of cyberpunk anime explores questions of consciousness and identity.",8.0
126,Akira,Animation/Sci-Fi,1988,"A secret military project endangers Neo-Tokyo when it turns a biker gang member into a rampaging psychic psychopath who can only be stopped by a group of psionic children. The film that introduced anime to Western audiences.",8.0
127,Perfect Blue,Animation/Thriller,1997,"A pop singer gives up her career to become an actress, but she is stalked by an obsessed fan and what seems to be a ghost of her past. Satoshi Kon's debut feature is a dazzling, disturbing psychological thriller.",8.0
128,Grave of the Fireflies,Animation/War/Drama,1988,"A young boy and his little sister struggle to survive in Japan during World War II. Studio Ghibli's most devastating film is a pacifist masterpiece that ranks among the saddest films ever made.",8.5
129,Wolf Children,Animation/Fantasy/Drama,2012,"A young woman falls in love with a wolf man, and after his death, she raises their two wolf children in rural Japan. A deeply moving examination of motherhood, identity, and the pain of growing up.",8.0
130,Your Name,Animation/Romance/Fantasy,2016,"Two strangers find themselves linked in a bizarre way. When a connection forms, will distance be the only thing to keep them apart? Makoto Shinkai's globally beloved film is the highest-grossing anime film of all time.",8.4
131,The Shining,Horror,1980,"A family heads to an isolated hotel for the winter where a sinister presence influences the father into violence, while his psychic son sees horrific forebodings from the past and future. Kubrick's horror masterpiece.",8.4
132,It,Horror,2017,"In the summer of 1989, a group of bullied kids band together to destroy a shape-shifting monster that has been terrorizing their small town. Bill Skarsgård's Pennywise is a genuinely terrifying creation.",7.3
133,A Nightmare on Elm Street,Horror,1984,"Teenagers in a small town are being killed in their dreams by a horribly disfigured man in a striped sweater and razor-fingered glove. Wes Craven's monster Freddy Krueger became one of horror's great icons.",7.5
134,Halloween,Horror,1978,"Fifteen years after murdering his sister on Halloween night 1963, Michael Myers escapes from a mental hospital and returns to the small town of Haddonfield to kill again. John Carpenter's film essentially created the slasher genre.",7.7
135,The Exorcist,Horror,1973,"When a teenage girl is possessed by a mysterious entity, her mother seeks the help of two priests to save her daughter. William Friedkin's film is widely considered the scariest movie ever made.",8.1
136,Hereditary,Horror/Drama,2018,"After the family matriarch passes away, a grieving family is haunted by disturbing secrets and an unsettling presence that emerges from their ancestry. Ari Aster's debut is one of the most relentlessly terrifying horror films in years.",7.3
137,Midsommar,Horror/Drama,2019,"A couple travels to Sweden to visit a rural hometown's fabled midsummer festival. What begins as an idyllic retreat quickly devolves into an increasingly violent and bizarre competition. A horror film drenched in sunlight.",7.1
138,Us,Horror/Thriller,2019,"A family's serene beach vacation turns to chaos when their doppelgängers appear and begin to terrorize them. Jordan Peele's follow-up to Get Out operates on multiple levels of social allegory and pure fright.",6.8
139,The Witch,Horror,2015,"A Puritan family living on the edge of a New England wilderness in the 17th century begins to fall apart due to a mysterious evil. Robert Eggers' debut is a period horror of extraordinary atmosphere and dread.",6.9
140,Arrival,Sci-Fi/Drama,2016,"A linguist works with the military to communicate with alien lifeforms after twelve mysterious spacecraft appear around the world. Denis Villeneuve's cerebral sci-fi is built on a devastating emotional twist.",7.9
141,Ex Machina,Sci-Fi/Thriller,2014,"A young programmer is selected to participate in a ground-breaking experiment in synthetic intelligence by evaluating the human qualities of a highly advanced humanoid A.I. A stunning debut feature about consciousness and manipulation.",7.7
142,Black Mirror: Bandersnatch,Sci-Fi/Thriller,2018,"In 1984, a young programmer begins to question reality as he adapts a dark fantasy novel into a video game and soon finds himself in a bizarre journey. Netflix's interactive Black Mirror film experiments with the nature of choice.",7.2
143,The Platform,Sci-Fi/Horror,2019,"A man wakes up in a vertical prison where food descends on a platform, with those above eating their fill and those below starving. A brutal Spanish sci-fi allegory about inequality and human nature.",7.0
144,Bong Joon-ho: Okja,Sci-Fi/Drama,2017,"A young girl risks everything to prevent a powerful multinational company from kidnapping her beloved pig. Bong Joon-ho's Netflix film tackles factory farming and corporate greed through the lens of a children's adventure.",7.3
145,The Shape of Water,Fantasy/Romance,2017,"At a top secret research facility in the 1960s, a lonely janitor forms a unique relationship with an amphibious creature that is being held in captivity. Guillermo del Toro's fairy tale for adults won four Academy Awards.",7.3
146,Pan's Labyrinth,Fantasy/Drama,2006,"In the Falangist Spain of 1944, the bookish young stepdaughter of a sadistic army officer escapes into an eerie but captivating fantasy world. Del Toro's dark fairy tale is simultaneously beautiful and heartbreaking.",8.2
147,Crimson Peak,Gothic Horror/Fantasy,2015,"In the aftermath of a family tragedy, an aspiring author is torn between love for her childhood friend and the temptation of a mysterious stranger. Del Toro's most purely romantic film is a lush Gothic ghost story.",6.5
148,The Lighthouse,Horror/Drama,2019,"A supernatural tale of two lighthouse keepers on a remote and mysterious New England island in the 1890s. Robert Eggers' hallucinatory film is an astonishing feat of atmosphere and performance from Pattinson and Dafoe.",7.5
149,Room,Drama/Thriller,2015,"After five-year-old Jack and his mother escape from the enclosed environment where they have lived for his entire life, the boy must learn to live in the wider world. An intimate film about trauma, love, and resilience.",8.1
150,Brooklyn,Drama/Romance,2015,"An Irish immigrant lands in 1950s Brooklyn, where she quickly falls into a romance with a local. When her past catches up with her, however, she must choose between two countries and the lives that exist within. Saoirse Ronan is luminous.",7.4
151,Manchester by the Sea,Drama,2016,"A depressed uncle is asked to take care of his teenage nephew after the boy's father dies. Kenneth Lonergan's film about grief and inability to forgive oneself is one of the most quietly devastating American films of the decade.",7.8
152,Moonlight,Drama,2016,"A young African-American man grapples with his identity and sexuality while experiencing the everyday struggles of childhood, adolescence, and burgeoning adulthood. Barry Jenkins' film won the Best Picture Oscar in unforgettable circumstances.",7.4
153,Lady Bird,Coming-of-Age/Drama,2017,"A headstrong teenager navigates the ups and downs of being a senior in high school during the 2002-2003 school year, clashing with her overly critical mother and dreaming of escaping Sacramento for New York. Greta Gerwig's debut.",7.4
154,Little Women,Drama/Romance,2019,"Jo March reflects back and forth on her life, telling the beloved story of the March sisters — four young women each determined to live life on their own terms. Greta Gerwig's adaptation is a joyful, feminist reinvention.",7.8
155,Marriage Story,Drama/Romance,2019,"A stage director and his actress wife struggle through a coast-to-coast divorce that pushes them to their personal extremes. Noah Baumbach's film is devastating and funny in equal measure, anchored by two great performances.",7.9
156,The Irishman,Crime/Drama/Biography,2019,"A mob hitman recalls his possible involvement with the slaying of Jimmy Hoffa. Scorsese's three-and-a-half-hour Netflix epic is a meditation on loyalty, violence, and old age, featuring career-best work from De Niro and Pesci.",7.8
157,Once Upon a Time in Hollywood,Drama/Comedy,2019,"A faded television actor and his stunt double strive to achieve fame and success in the film industry during the final years of Hollywood's Golden Age in 1969 Los Angeles. Tarantino's most nostalgic and sun-drenched film.",7.6
158,Knives Out,Mystery/Comedy,2019,"A detective investigates the death of a patriarch of an eccentric, combative family. Rian Johnson's ingeniously constructed whodunnit pulls the rug out from under the audience halfway through, then does it again.",7.9
159,The Favourite,Drama/Comedy/Historical,2018,"In early 18th century England, a frail Queen Anne occupies the throne and her close friend Lady Sarah Churchill governs the country in her stead. Yorgos Lanthimos delivers a savage comedy about power and manipulation.",7.5
160,Shoplifters,Drama,2018,"A family of small-time crooks take in a child they find outside in the cold. As the bonds between them deepen, their secrets begin to emerge. Koreeda's Palme d'Or winner is a heartbreaking exploration of chosen family.",8.0
161,Burning,Thriller/Mystery,2018,"Lee Jong-su is a part-time worker who bumps into Hae-mi, a girl who used to live in his neighborhood. She asks him to look after her cat while she travels to Africa. When she returns with Ben, Jong-su begins to suspect the worst. A hypnotic mystery.",7.5
162,Portrait of a Lady on Fire,Romance/Drama,2019,"On an isolated island in Brittany at the end of the eighteenth century, a female painter is obliged to paint a wedding portrait of a young woman. A hauntingly beautiful film about desire and the male gaze.",8.1
163,Capernaum,Drama,2018,"A 12-year-old Lebanese boy sues his parents for neglect and reflects on his experiences of poverty and loss. Nadine Labaki's devastating film features a stunning performance from its non-professional lead.",8.4
164,A Separation,Drama/Thriller,2011,"A married couple are faced with a difficult decision — to improve the life of their child by moving to another country or to stay in Iran and look after a deteriorating parent. Asghar Farhadi's morally complex masterpiece.",8.3
165,The White Ribbon,Mystery/Drama,2009,"Strange events happen in a small Protestant village in northern Germany just before World War I, as the local children appear to be connected. Michael Haneke's black-and-white investigation of the origins of fascism.",7.8
166,Blue Is the Warmest Colour,Romance/Drama,2013,"Adèle's life is changed when she meets Emma, a young woman with blue hair, who will allow her to discover desire and to assert herself as a woman and as an adult. A rawly honest portrait of first love.",7.7
167,Before Sunrise,Romance/Drama,1995,"A young man and woman meet on a train in Europe and agree to spend one evening together in Vienna knowing they will probably never see each other again. Richard Linklater's film captures the electric feeling of falling in love in real time.",8.1
168,Before Sunset,Romance/Drama,2004,"Nine years after Jesse and Celine first met, they encounter each other again on the last leg of Jesse's book tour before his flight home. Almost entirely set in real time, the film feels like stolen time recovered.",8.1
169,Boyhood,Drama,2014,"The life of Mason, from early childhood to his arrival at college, is presented as a single seamless narrative. Richard Linklater filmed the same cast over 12 years in a one-of-a-kind experiment in naturalistic cinema.",7.9
170,The Tree of Life,Drama/Fantasy,2011,"The film follows the life journey of the eldest son, Jack, through the 1950s childhood of his family in Waco, Texas and into a modern day Texas sky. Terrence Malick's most personal and formally radical work.",6.8
171,Midnight in Paris,Romance/Comedy/Fantasy,2011,"While on a trip to Paris with his fiancée's family, a nostalgic screenwriter finds himself mysteriously going back to the 1920s every day at midnight. Woody Allen's most popular film in decades.",7.7
172,The Secret Life of Walter Mitty,Adventure/Drama/Comedy,2013,"When his job along with that of his co-worker are threatened, Walter takes action in the real world embarking on a global journey that turns into an adventure. Ben Stiller's gorgeous celebration of wanderlust.",7.3
173,Into the Wild,Adventure/Drama/Biography,2007,"After graduating from Emory University, top student and athlete Christopher McCandless abandons his possessions, gives his entire savings account to charity and hitchhikes to Alaska to live in the wilderness. An American idealist tragedy.",8.1
174,127 Hours,Drama/Adventure/Biography,2010,"An adventurous mountain climber becomes trapped under a boulder while canyoneering alone near Moab, Utah and resorts to desperate measures in order to survive. Danny Boyle brings explosive energy to a story of impossible survival.",7.6
175,Wild,Drama/Adventure/Biography,2014,"A woman, after the death of her mother, and the subsequent disintegration of her marriage and personal life, regroups by hiking more than a thousand miles on the Pacific Crest Trail alone. Reese Witherspoon is raw and revelatory.",7.1
176,The Revenant,Drama/Adventure,2015,"A frontiersman on a fur trading expedition in the 1820s fights for survival after being mauled by a bear. Leonardo DiCaprio won his long-awaited Oscar for a physically demanding, almost wordless performance.",8.0
177,Everest,Drama/Adventure/Biography,2015,"The story of the 1996 Mount Everest disaster where eight people lost their lives in a ferocious storm. A visually spectacular but emotionally gripping account of human ambition and its cost.",7.1
178,The Walk,Drama/Biography,2015,"The story of Philippe Petit's daring, but illegal, high-wire walk between the Twin Towers on August 7, 1974. Robert Zemeckis' film makes the heart stop even when you know the outcome.",7.3
179,Bohemian Rhapsody,Drama/Biography/Music,2018,"The story of the legendary British rock band Queen and lead singer Freddie Mercury, leading up to their famous performance at the Live Aid concert.",7.9
180,Rocketman,Drama/Biography/Music,2019,"A musical fantasy about the fantastical human story of Elton John's breakthrough years. Taron Egerton commits fully to the role, delivering both the songs and the man's volcanic emotional life.",7.3
181,Straight Outta Compton,Drama/Biography/Music,2015,"The group NWA emerges from the mean streets of Compton in Los Angeles, California, in the mid-1980s and revolutionizes pop culture with their music and tales about life in the hood. An energetic celebration of hip-hop's origins.",7.9
182,8 Mile,Drama/Music,2002,"A young rapper, struggling with every aspect of his life, wants to make it big but his friends and foes make this odyssey of rap harder than it may seem. Eminem's surprisingly effective acting debut.",7.2
183,Hustle and Flow,Drama/Music,2005,"With help from his friends, a Memphis pimp in a mid-life crisis attempts to fulfill his dream of becoming a successful hip-hop artist. A gritty, sympathetic portrait of creative ambition in desperate circumstances.",7.5
184,Almost Famous,Drama/Comedy/Music,2000,"A high-school boy in the early 1970s is given the chance to write a story for Rolling Stone magazine about an up-and-coming rock band as he accompanies them on their concert tour. Cameron Crowe's most personal film.",7.9
185,School of Rock,Comedy/Music,2003,"After being kicked out of his rock band, Dewey Finn becomes a substitute teacher of an uptight elementary private school, only to try and turn his class into a rock band. Jack Black's most beloved and purely fun performance.",7.1
186,The Blues Brothers,Musical/Comedy/Action,1980,"Jake Blues, just out from prison, puts together his old band to save the Catholic home where he and his brother Elwood were raised. A spectacular and hilarious celebration of blues and soul music that invented the modern movie musical.",7.9
187,O Brother Where Art Thou,Comedy/Crime/Music,2000,"In the deep south during the 1930s, three escaped convicts search for hidden treasure while a relentless lawman pursues them. The Coen Brothers' loose adaptation of the Odyssey is packed with brilliant music and comic invention.",7.8
188,Fargo,Crime/Thriller/Comedy,1996,"Jerry Lundegaard's inept crime falls apart due to his and his henchmen's bungling and the persistent police work of the quite pregnant Marge Gunderson. Frances McDormand won the Oscar in one of the great police procedural films.",8.1
189,The Big Lebowski,Comedy/Crime,1998,"'The Dude' Lebowski, mistaken for a millionaire Lebowski, seeks restitution for his ruined rug and enlists his bowling buddies to help get it. The Coen Brothers' most beloved cult comedy.",8.1
190,Burn After Reading,Comedy/Crime/Thriller,2008,"A disk containing memoirs of a CIA analyst falls into the hands of two unscrupulous gym employees who attempt to sell it. A darkly comic portrait of Washington D.C. incompetence and self-delusion.",7.0
191,Prisoners,Crime/Thriller/Drama,2013,"When Keller Dover's daughter and her friend go missing, he takes matters into his own hands as the police pursue multiple leads and the pressure mounts. Denis Villeneuve's American debut is a morally devastating thriller.",8.1
192,Zodiac,Crime/Thriller,2007,"A San Francisco cartoonist becomes an amateur detective obsessed with tracking down the Zodiac killer, a serial murderer who terrified the San Francisco Bay Area, targeting cops and leaving cryptic messages. Fincher at his most methodical.",7.7
193,Se7en,Crime/Thriller,1995,"Two detectives, a rookie and a veteran, hunt a serial killer who uses the seven deadly sins as his motives. David Fincher's film contains one of cinema's most memorable and disturbing final scenes.",8.6
194,Gone Girl,Thriller/Mystery,2014,"With his wife's disappearance having become the focus of an intense media circus, a man sees the spotlight turned on him when it's suspected that he may not be innocent. David Fincher at his most icily manipulative.",8.1
195,The Girl with the Dragon Tattoo,Thriller/Mystery,2011,"Journalist Mikael Blomkvist is aided in his search for a woman who has been missing for forty years by Lisbeth Salander, a young computer hacker. Fincher brings his characteristic precision to this Scandinavian thriller.",7.8
196,Heat,Crime/Thriller,1995,"A group of professional bank robbers start to feel the heat from police when they unknowingly leave a clue at their latest heist. Michael Mann's three-hour crime epic contains the greatest coffee-shop scene in cinema history.",8.3
197,Collateral,Crime/Thriller,2004,"A cab driver finds himself the hostage of an engaging contract killer as he makes his rounds from hit to hit during one night in Los Angeles. Tom Cruise plays against type with electrifying effect.",7.6
198,Nightcrawler,Crime/Thriller,2014,"When Louis Bloom, a con man desperate for work, muscles into the world of L.A. crime journalism, he blurs the line between observer and participant to become the star of his own story. Jake Gyllenhaal is genuinely frightening.",7.9
199,Drive,Crime/Action,2011,"A mysterious Hollywood stuntman and mechanic moonlights as a getaway driver and finds himself in trouble when he tries to help out his neighbor. Ryan Gosling's most perfectly calibrated performance.",7.8
